{"format":"h5carry-plan","graph":{"links":[{"kind":"hard","path":"/axes","target":"/axes"},{"kind":"hard","path":"/axes/channel","target":"/axes/channel"},{"kind":"hard","path":"/axes/time","target":"/axes/time"},{"kind":"hard","path":"/calibration","target":"/calibration"},{"kind":"hard","path":"/calibration/gain","target":"/calibration/gain"},{"kind":"hard","path":"/runs","target":"/runs"},{"kind":"hard","path":"/runs/selected","target":"/runs/selected"},{"kind":"soft","path":"/runs/selected/gain","target":"/calibration/gain"},{"kind":"hard","path":"/runs/selected/intensity","target":"/runs/selected/intensity"},{"kind":"hard","path":"/runs/selected/intensity_alias","target":"/runs/selected/intensity"},{"kind":"hard","path":"/runs/selected/targets","target":"/runs/selected/targets"}],"objects":[{"id":"/","kind":"group","metadata":{"attributes":[]}},{"id":"/axes","kind":"group","metadata":{"attributes":[]}},{"id":"/axes/channel","kind":"dataset","metadata":{"attributes":[],"creation":{"chunks":null,"fill":"0000","filters":[],"layout":"contiguous","maxshape":[3]},"dtype":{"encoding":null,"kind":"fixed","str":"<i2"},"labels":[""],"payload_sha256":"047dbf5366372631ba7e3e02520e651446b899c96c4b64663bac378a298a7bf7","scale_name":"coordinate","shape":[3]}},{"id":"/axes/time","kind":"dataset","metadata":{"attributes":[],"creation":{"chunks":null,"fill":"0000000000000000","filters":[],"layout":"contiguous","maxshape":[4]},"dtype":{"encoding":null,"kind":"fixed","str":"<f8"},"labels":[""],"payload_sha256":"1f8ca26fda2a620f4272dfe8264145b694be8cac4a09125b5fccc32450cbccd1","scale_name":"coordinate","shape":[4]}},{"id":"/calibration","kind":"group","metadata":{"attributes":[]}},{"id":"/calibration/gain","kind":"dataset","metadata":{"attributes":[{"dtype":{"encoding":"utf-8","kind":"text","str":"|O"},"name":"unit","shape":[],"value":["64696d656e73696f6e6c657373"]}],"creation":{"chunks":null,"fill":"0000000000000000","filters":[],"layout":"contiguous","maxshape":[3]},"dtype":{"encoding":null,"kind":"fixed","str":"<f8"},"labels":[""],"payload_sha256":"ad1461355d664226df0a9dd36082ce06afa03d52a19beb8e90853216ef6b221e","scale_name":null,"shape":[3]}},{"id":"/runs","kind":"group","metadata":{"attributes":[]}},{"id":"/runs/selected","kind":"group","metadata":{"attributes":[{"dtype":{"encoding":null,"kind":"reference","str":"|O"},"name":"calibration_ref","shape":[],"value":null}]}},{"id":"/runs/selected/intensity","kind":"dataset","metadata":{"attributes":[{"dtype":{"encoding":"utf-8","kind":"text","str":"|O"},"name":"marker","shape":[],"value":["73656c6563746564"]}],"creation":{"chunks":[2,3],"fill":"00000000","filters":[{"flags":1,"id":1,"values":[4]}],"layout":"chunked","maxshape":[4,3]},"dtype":{"encoding":null,"kind":"fixed","str":"<i4"},"labels":["time",""],"payload_sha256":"a4886fc88eadb553f0300776411b64c557a02e7a09f9df7da871fb2f9f4c8278","scale_name":null,"shape":[4,3]}},{"id":"/runs/selected/targets","kind":"dataset","metadata":{"attributes":[],"creation":{"chunks":null,"fill":null,"filters":[],"layout":"contiguous","maxshape":[2]},"dtype":{"encoding":null,"kind":"reference","str":"|O"},"labels":[""],"payload_sha256":null,"scale_name":null,"shape":[2]}}],"payload_bytes":126,"reasons":{"/":["ancestor container"],"/axes":["ancestor container"],"/axes/channel":["scale for /runs/selected/intensity axis 1"],"/axes/time":["scale for /runs/selected/intensity axis 0"],"/calibration":["ancestor container"],"/calibration/gain":["soft-link target from /runs/selected/gain"],"/runs":["ancestor container"],"/runs/selected":["ancestor container","selected /runs/selected"],"/runs/selected/intensity":["selected /runs/selected"],"/runs/selected/targets":["selected /runs/selected"]},"references":[{"attribute":"calibration_ref","index":0,"owner":"/runs/selected","target":"/calibration/gain"},{"attribute":null,"index":0,"owner":"/runs/selected/targets","target":"/calibration/gain"},{"attribute":null,"index":1,"owner":"/runs/selected/targets","target":null}],"scales":[{"axis":0,"consumer":"/runs/selected/intensity","scale":"/axes/time"},{"axis":1,"consumer":"/runs/selected/intensity","scale":"/axes/channel"}]},"limits":{"chunk_bytes":1048576,"discovery_seconds":60,"max_attribute_bytes":262144,"max_depth":64,"max_edges":50000,"max_name_bytes":1024,"max_objects":10000,"max_payload_bytes":268435456,"max_plan_bytes":8388608,"max_rank":32},"selections":["/runs/selected"],"source":{"sha256":"c659c5ae509e630bf1886a2413e1540f74e4bd121426721004eaa420ccda04ce","size":24824},"version":1}